{"$id":"urn:mcpaudit:evidence-conservation:OwnershipPreflightV1","$schema":"https://json-schema.org/draft/2020-12/schema","additionalProperties":false,"properties":{"admission_status":{"enum":["CANDIDATE","ADMITTED","REJECTED"]},"body":{"additionalProperties":false,"properties":{"allowed_writes":{"items":{"minLength":1,"type":"string"},"minItems":1,"type":"array"},"forbidden_effects":{"items":{"minLength":1,"type":"string"},"minItems":1,"type":"array"},"fresh_for_seconds":{"minimum":1,"type":"integer"},"git_state":{"additionalProperties":false,"properties":{"preserved_paths":{"items":{"minLength":1,"type":"string"},"type":"array"},"tracked_changes":{"items":{"minLength":1,"type":"string"},"type":"array"},"untracked_changes":{"items":{"minLength":1,"type":"string"},"type":"array"}},"required":["tracked_changes","untracked_changes","preserved_paths"],"type":"object"},"lease":{"additionalProperties":false,"properties":{"expires_at_utc":{"type":["string","null"]},"owner":{"minLength":1,"type":"string"},"state":{"enum":["HELD","AVAILABLE","CONFLICT"]}},"required":["state","owner","expires_at_utc"],"type":"object"},"observed_at_utc":{"minLength":1,"type":"string"},"peer_preflight":{"additionalProperties":false,"properties":{"checker":{"minLength":1,"type":"string"},"receipt_sha256":{"pattern":"^[0-9a-f]{64}$","type":"string"},"result":{"const":"CLAIM"}},"required":["checker","receipt_sha256","result"],"type":"object"},"publication":{"additionalProperties":false,"properties":{"allowed":{"const":false},"remote_effects":{"const":false}},"required":["allowed","remote_effects"],"type":"object"},"target":{"additionalProperties":false,"properties":{"base_ref":{"minLength":1,"type":"string"},"branch":{"minLength":1,"type":"string"},"head_sha":{"pattern":"^[0-9a-f]{40}$","type":"string"},"repository":{"minLength":1,"type":"string"},"worktree":{"minLength":1,"type":"string"}},"required":["repository","worktree","branch","head_sha","base_ref"],"type":"object"}},"required":["observed_at_utc","fresh_for_seconds","target","git_state","lease","peer_preflight","allowed_writes","forbidden_effects","publication"],"type":"object"},"content_sha256":{"pattern":"^[0-9a-f]{64}$","type":"string"},"created_at_utc":{"minLength":1,"type":"string"},"producer":{"additionalProperties":false,"properties":{"actor_id":{"minLength":1,"type":"string"},"role":{"minLength":1,"type":"string"}},"required":["actor_id","role"],"type":"object"},"record_id":{"minLength":1,"type":"string"},"reviews":{"items":{"additionalProperties":false,"properties":{"decision":{"enum":["ADMIT","REJECT"]},"independent_from":{"items":{"minLength":1,"type":"string"},"type":"array"},"rationale":{"minLength":1,"type":"string"},"reviewed_at_utc":{"minLength":1,"type":"string"},"reviewed_content_sha256":{"pattern":"^[0-9a-f]{64}$","type":"string"},"reviewer_id":{"minLength":1,"type":"string"}},"required":["reviewer_id","independent_from","decision","reviewed_at_utc","reviewed_content_sha256","rationale"],"type":"object"},"type":"array"},"schema":{"const":"OwnershipPreflightV1"},"spec_sha256":{"pattern":"^[0-9a-f]{64}$","type":"string"},"supersedes":{"type":["string","null"]}},"required":["schema","record_id","spec_sha256","created_at_utc","producer","supersedes","body","content_sha256","reviews","admission_status"],"type":"object"}
