{
  "admission_status": "CANDIDATE",
  "body": {
    "allowed_writes": [
      "docs/proof-packages/20260731-evidence-conservation/README.md",
      "docs/proof-packages/20260731-evidence-conservation/admission-report.md",
      "docs/proof-packages/20260731-evidence-conservation/admission-summary.json",
      "docs/proof-packages/20260731-evidence-conservation/generation-manifest.json",
      "docs/proof-packages/20260731-evidence-conservation/spec/evidence-conservation-v1.md",
      "docs/proof-packages/20260731-evidence-conservation/spec/evidence-conservation-v1.sha256",
      "docs/proof-packages/20260731-evidence-conservation/contracts/frozen-contracts-v1.json",
      "docs/proof-packages/20260731-evidence-conservation/paths/p1.json",
      "docs/proof-packages/20260731-evidence-conservation/paths/p2.json",
      "docs/proof-packages/20260731-evidence-conservation/paths/p3.json",
      "docs/proof-packages/20260731-evidence-conservation/fixtures/fx-01.json",
      "docs/proof-packages/20260731-evidence-conservation/fixtures/fx-02.json",
      "docs/proof-packages/20260731-evidence-conservation/fixtures/fx-03.json",
      "docs/proof-packages/20260731-evidence-conservation/fixtures/fx-04.json",
      "docs/proof-packages/20260731-evidence-conservation/fixtures/fx-05.json",
      "docs/proof-packages/20260731-evidence-conservation/fixtures/fx-06.json",
      "docs/proof-packages/20260731-evidence-conservation/fixtures/fx-07.json",
      "docs/proof-packages/20260731-evidence-conservation/fixtures/fx-08.json",
      "docs/proof-packages/20260731-evidence-conservation/fixtures/fx-09.json",
      "docs/proof-packages/20260731-evidence-conservation/fixtures/fx-10.json",
      "docs/proof-packages/20260731-evidence-conservation/fixtures/fx-11.json",
      "docs/proof-packages/20260731-evidence-conservation/fixtures/fx-12.json",
      "docs/proof-packages/20260731-evidence-conservation/fixtures/fx-13.json",
      "docs/proof-packages/20260731-evidence-conservation/fixtures/fx-14.json",
      "docs/proof-packages/20260731-evidence-conservation/fixtures/fx-15.json",
      "docs/proof-packages/20260731-evidence-conservation/fixtures/fx-16.json",
      "docs/proof-packages/20260731-evidence-conservation/fixtures/fx-17.json",
      "docs/proof-packages/20260731-evidence-conservation/fixtures/fx-18.json",
      "docs/proof-packages/20260731-evidence-conservation/fixtures/fx-19.json",
      "docs/proof-packages/20260731-evidence-conservation/fixtures/fx-20.json",
      "docs/proof-packages/20260731-evidence-conservation/fixtures/fx-21.json",
      "docs/proof-packages/20260731-evidence-conservation/policies/privacy-locality-v1.json",
      "docs/proof-packages/20260731-evidence-conservation/policies/secret-patterns-v1.json",
      "docs/proof-packages/20260731-evidence-conservation/schemas/common-record-envelope-v1.schema.json",
      "docs/proof-packages/20260731-evidence-conservation/schemas/boundary-decision-v1.schema.json",
      "docs/proof-packages/20260731-evidence-conservation/schemas/freeze-receipt-v1.schema.json",
      "docs/proof-packages/20260731-evidence-conservation/schemas/oracle-adjudication-v1.schema.json",
      "docs/proof-packages/20260731-evidence-conservation/schemas/fixture-admissibility-v1.schema.json",
      "docs/proof-packages/20260731-evidence-conservation/schemas/determinism-profile-v1.schema.json",
      "docs/proof-packages/20260731-evidence-conservation/schemas/coverage-delta-v1.schema.json",
      "docs/proof-packages/20260731-evidence-conservation/schemas/ownership-preflight-v1.schema.json",
      "docs/proof-packages/20260731-evidence-conservation/schemas/primary-fixture-v1.schema.json",
      "docs/proof-packages/20260731-evidence-conservation/schemas/p1-consumer-input-v1.schema.json",
      "docs/proof-packages/20260731-evidence-conservation/schemas/p2-fixture-admissibility-v1.schema.json",
      "docs/proof-packages/20260731-evidence-conservation/schemas/p3-recovery-fixture-v1.schema.json",
      "docs/proof-packages/20260731-evidence-conservation/schemas/admission-summary-v1.schema.json",
      "docs/proof-packages/20260731-evidence-conservation/schemas/generation-manifest-v1.schema.json",
      "docs/proof-packages/20260731-evidence-conservation/records/boundary-decision-v1.json",
      "docs/proof-packages/20260731-evidence-conservation/records/freeze-receipt-p1-v1.json",
      "docs/proof-packages/20260731-evidence-conservation/records/freeze-receipt-p2-v1.json",
      "docs/proof-packages/20260731-evidence-conservation/records/freeze-receipt-p3-v1.json",
      "docs/proof-packages/20260731-evidence-conservation/records/oracle-adjudication-v1.json",
      "docs/proof-packages/20260731-evidence-conservation/records/determinism-profile-v1.json",
      "docs/proof-packages/20260731-evidence-conservation/records/coverage-delta-v1.json",
      "docs/proof-packages/20260731-evidence-conservation/records/ownership-preflight-v1.json",
      "docs/proof-packages/20260731-evidence-conservation/records/fixture-admissibility/fx-01-v1.json",
      "docs/proof-packages/20260731-evidence-conservation/records/fixture-admissibility/fx-02-v1.json",
      "docs/proof-packages/20260731-evidence-conservation/records/fixture-admissibility/fx-03-v1.json",
      "docs/proof-packages/20260731-evidence-conservation/records/fixture-admissibility/fx-04-v1.json",
      "docs/proof-packages/20260731-evidence-conservation/records/fixture-admissibility/fx-05-v1.json",
      "docs/proof-packages/20260731-evidence-conservation/records/fixture-admissibility/fx-06-v1.json",
      "docs/proof-packages/20260731-evidence-conservation/records/fixture-admissibility/fx-07-v1.json",
      "docs/proof-packages/20260731-evidence-conservation/records/fixture-admissibility/fx-08-v1.json",
      "docs/proof-packages/20260731-evidence-conservation/records/fixture-admissibility/fx-09-v1.json",
      "docs/proof-packages/20260731-evidence-conservation/records/fixture-admissibility/fx-10-v1.json",
      "docs/proof-packages/20260731-evidence-conservation/records/fixture-admissibility/fx-11-v1.json",
      "docs/proof-packages/20260731-evidence-conservation/records/fixture-admissibility/fx-12-v1.json",
      "docs/proof-packages/20260731-evidence-conservation/records/fixture-admissibility/fx-13-v1.json",
      "docs/proof-packages/20260731-evidence-conservation/records/fixture-admissibility/fx-14-v1.json",
      "docs/proof-packages/20260731-evidence-conservation/records/fixture-admissibility/fx-15-v1.json",
      "docs/proof-packages/20260731-evidence-conservation/records/fixture-admissibility/fx-16-v1.json",
      "docs/proof-packages/20260731-evidence-conservation/records/fixture-admissibility/fx-17-v1.json",
      "docs/proof-packages/20260731-evidence-conservation/records/fixture-admissibility/fx-18-v1.json",
      "docs/proof-packages/20260731-evidence-conservation/records/fixture-admissibility/fx-19-v1.json",
      "docs/proof-packages/20260731-evidence-conservation/records/fixture-admissibility/fx-20-v1.json",
      "docs/proof-packages/20260731-evidence-conservation/records/fixture-admissibility/fx-21-v1.json",
      "docs/proof-packages/20260731-evidence-conservation/tools/package_lib.py",
      "docs/proof-packages/20260731-evidence-conservation/tools/build_package.py",
      "docs/proof-packages/20260731-evidence-conservation/tools/validate_package.py",
      "docs/proof-packages/20260731-evidence-conservation/tests/test_evidence_package.py",
      "docs/proof-packages/20260731-evidence-conservation/verification/runtime-observation.json",
      "docs/proof-packages/20260731-evidence-conservation/verification/frozen-object-verification.json",
      "docs/proof-packages/20260731-evidence-conservation/verification/lock-consistency-p1.json",
      "docs/proof-packages/20260731-evidence-conservation/verification/lock-consistency-p2.json",
      "docs/proof-packages/20260731-evidence-conservation/verification/lock-consistency-p3.json",
      "docs/proof-packages/20260731-evidence-conservation/verification/deterministic-regeneration.json"
    ],
    "forbidden_effects": [
      "ANY_WRITE_OUTSIDE_ALLOWED_WRITES",
      "ANY_FURTHER_REMOTE_PUSH",
      "PULL_REQUEST_OR_ISSUE_CREATION",
      "DEPLOYMENT_PUBLICATION_TAG_OR_RELEASE",
      "PRODUCER_OR_CONSUMER_REPOSITORY_MUTATION",
      "PORTFOLIO_COMMAND_CENTER_INVOCATION",
      "MCP_TRUST_INVOCATION",
      "BRIDGE_DB_CONSUMER_INVOCATION",
      "PRIMARY_CASE_EXECUTION",
      "MCPAUDIT_SCAN_OR_PROTOCOL_AUDITOR_EXECUTION",
      "LIVE_CONNECTOR_CREDENTIAL_SCHEDULER_HOST_BUYER_OR_PARTICIPANT_ACCESS",
      "PACKAGE_INSTALL_OR_UPDATE",
      "BRIDGE_DB_MUTATION_BEFORE_TERMINAL_RECEIPT_EXCEPTION"
    ],
    "fresh_for_seconds": 1800,
    "git_state": {
      "preserved_paths": [
        "<workspace>/MCPAudit",
        "<workspace>/_codex-worktrees"
      ],
      "tracked_changes": [],
      "untracked_changes": []
    },
    "lease": {
      "expires_at_utc": null,
      "owner": "codex",
      "state": "HELD"
    },
    "observed_at_utc": "2026-07-31T16:01:37Z",
    "peer_preflight": {
      "checker": "<workspace>/peer-agent-tools/peer-preflight.sh",
      "receipt_sha256": "343feb2d5d14bb0c9aea8ed1f2a3fe66a4fdbc605910e20c9601ada7d10933ea",
      "result": "CLAIM"
    },
    "publication": {
      "allowed": false,
      "remote_effects": false
    },
    "target": {
      "base_ref": "refs/remotes/origin/main@0e101cbfb9136bf62b38e668a15af9f683cde48e",
      "branch": "codex/evidence-conservation-package-20260731",
      "head_sha": "0e101cbfb9136bf62b38e668a15af9f683cde48e",
      "repository": "<workspace>/MCPAudit",
      "worktree": "<workspace>/.codex-worktrees/mcpaudit-evidence-conservation-package-20260731"
    }
  },
  "content_sha256": "83be64e35dc25798ffd8cc124cf0394e929497c946e9cdcde40743cc30418e64",
  "created_at_utc": "2026-07-31T16:01:37Z",
  "producer": {
    "actor_id": "codex",
    "role": "EVIDENCE_PACKAGE_GENERATOR"
  },